{
  "schema_version": 1,
  "id": "evt_01K5R8Z9M8R1X6Y0Z5D7F9H1K3",
  "timestamp": "2026-09-18T10:42:15.220Z",
  "observed_at": "2026-09-18T10:42:15.281Z",
  "type": "process.started",
  "source": "windows.process",
  "host_id": "host_01K5R8Z9M4Q7T2V6X1B3D5F7H9",
  "boot_id": "boot_01K5R8Z9M4Q7T2V6X1B3D5F7HA",
  "actor": {
    "type": "process",
    "id": "proc_01M2SZAT80WBG97HT3GY4XRGRK",
    "name": "explorer.exe"
  },
  "subject": {
    "type": "process",
    "id": "proc_01M2T1R61M8W1EMS4WBMRDKSTZ",
    "name": "notepad.exe"
  },
  "attributes": {
    "pid": 9812,
    "parent_pid": 4312,
    "executable": "C:\\Windows\\System32\\notepad.exe",
    "command_line": "notepad.exe",
    "user_sid": "S-1-5-21-1000000000-2000000000-3000000000-1001",
    "process_started_at": "2026-09-18T10:42:15.220Z",
    "parent_resolved": true
  },
  "raw_event_id": "raw_01K5R8Z9M5P8W3X7Y2C4E6G8J0",
  "trace_id": null,
  "tags": []
}
